title,subject,interal_id,url,id_number,description
Place value and rounding,3rd grade,xb514f3b9,https://api.khanacademy.org/math/cc-third-grade-math/cc-3rd-place-value-rounding,cc-3rd-place-value-rounding,Going a bit deeper with our understanding of place value from 2nd grade.  We'll apply this knowledge to learn to round things to the nearest 10 and 100.
Addition and subtraction,4th grade,x447822a8,https://www.khanacademy.org/math/cc-fourth-grade-math/cc-4th-add-sub-topic,cc-4th-add-sub-topic,Fourth grade is the time to really fine-tune your addition and subtraction skills to the point that you can add and subtract pretty much any multi-digit  whole number!
Multiplication and division,4th grade,xb55cb073,https://www.khanacademy.org/math/cc-fourth-grade-math/cc-4th-mult-div-topic,cc-4th-mult-div-topic,Let's continue on the multiplication and division adventure that was started in third grade. We'll think about multiplying and dividing with whole numbers and discover that sometimes we have a leftover  or a remainder  when we divide. These tutorials will also help you get comfortable with multiplying multi-digit numbers  long division  and solving word problems. Let's do this people!
Fractions,4th grade,xfaed0f99,https://www.khanacademy.org/math/cc-fourth-grade-math/cc-4th-fractions-topic,cc-4th-fractions-topic,Learn how to do basic arithmetic with fractions (add  subtract  and multiply). Also learn about mixed numbers and equivalent fractions  and use this knowledge to compare fractions with unlike denominators.
Decimals,4th grade,xcc4bb0c3,https://www.khanacademy.org/math/cc-fourth-grade-math/cc-4th-decimals,cc-4th-decimals,Learn what decimal numbers are  and see how decimals are related to fractions. Along the way  find decimals on the number line  convert between fractions and decimals  and compare decimals.
Measurement and data,4th grade,x58fcadff,https://www.khanacademy.org/math/cc-fourth-grade-math/cc-4th-measurement-topic,cc-4th-measurement-topic,When we measure anything  we do it in human-defined 'units'.  Different units were defined in different places and for different scales.  The two most common are U.S. customary units and metric units. Let's think about how to convert between and among them!  We'll also continue thinking about perimeter and area!
Geometry,4th grade,xd796b5cb,https://www.khanacademy.org/math/cc-fourth-grade-math/cc-4th-geometry-topic,cc-4th-geometry-topic,Finally  we're getting to geometry. We've been waiting for this and hope you have been  too. The foundation of all geometry is the line--so that's a great place to start. From there we'll move into angles  quadrilaterals  and triangles. Our goal here is to get familiar with the basic concepts  skills  and applications of geometry. So jump in and let's go for a ride!
Factors multiples and patterns,4th grade,xa391e5e5,https://www.khanacademy.org/math/cc-fourth-grade-math/cc-4th-fact-mult-topic,cc-4th-fact-mult-topic,We know that 3x2x5 = 30.  So 2  3  and 5 are factors of 30.  30 is a multiple of each of 3  2  and 5.  If a number only has itself and 1 as factors  then the number is "prime".  Don't worry  this is explained in much more depth in the tutorials in this topic.  We will also explore some mathematical patterns.
Place value and rounding,4th grade,x4d29b2d1,https://www.khanacademy.org/math/cc-fourth-grade-math/cc-4th-place-value-rounding,cc-4th-place-value-rounding,We've been exploring place for a while  thinking about ones  tens  and hundreds. But now we're ready to tackle all whole numbers  including numbers in the thousands  millions  and beyond!
Arithmetic operations,5th grade,x59c3b242,https://api.khanacademy.org/math/cc-fifth-grade-math/cc-5th-arith-operations,cc-5th-arith-operations,Let's begin our journey together in 5th grade with good ole fashioned arithmetic. Don't assume that this has to be boring...not at all! We're going to have fun as we learn about and practice adding  subtracting  multiplying  and dividing whole numbers and decimals. We know you're probably pretty comfortable with basic arithmetic  so we'll try to challenge you a little more in these tutorials!
Fractions,5th grade,x91cad26e,https://api.khanacademy.org/math/cc-fifth-grade-math/cc-5th-fractions-topic,cc-5th-fractions-topic,Learn to add  subtract  multiply  and divide fractions and mixed numbers.
Place value and decimals,5th grade,xdd840283,https://api.khanacademy.org/math/cc-fifth-grade-math/cc-5th-place-value-decimals-top,cc-5th-place-value-decimals-top,To really understand how decimal numbers work  we need a deep understanding of place value. The big picture goal of these tutorials is to connect decimal place value to the idea of multiplying by 10.
Measurement and data,5th grade,x0ad7497b,https://api.khanacademy.org/math/cc-fifth-grade-math/cc-5th-measurement-topic,cc-5th-measurement-topic,If you think about it  we measure almost everything: time  distance  size  weight  volume  etc. Every THING can be measured. The question is  what unit of measurement is used and how is that unit constructed  compared  and converted? This last part is what we explore in these tutorials.
Geometry,5th grade,x6e6877f8,https://api.khanacademy.org/math/cc-fifth-grade-math/cc-5th-geometry-topic,cc-5th-geometry-topic,We're going to stick our toes into the proverbial waters of geometry! For those of you that are visual learners you'll love this topic. We'll examine all kinds of lines and shapes in the 1st  2nd  and 3rd dimensions. Topics we'll cover include the coordinate plane  plotting points  quadrilaterals  parallelograms  trapezoids  and rhombi (plural for a rhombus). Start your engines!
Algebraic thinking,5th grade,x49226f8c,https://api.khanacademy.org/math/cc-fifth-grade-math/cc-5th-algebraic-thinking,cc-5th-algebraic-thinking,Arithmetic is fun  but algebra is a blast! Look  nothing is easy the first time you try it so don't get discouraged. These tutorials will give you some straightforward explanations and examples to get you started down the road of algebraic thinking. We'll practice writing and evaluating numerical expressions  as well as seeing  interpreting  and graphing patterns and relationships between numbers. We're laying the foundation for lots of good learning ahead!
Ratios rates & percentages,6th grade,x22eef7de,https://www.khanacademy.org/math/cc-sixth-grade-math/cc-6th-ratios-prop-topic,cc-6th-ratios-prop-topic,Ratios  rates  and percentages are some of the most useful math concepts in real life (and what is REAL life anyway  huh?). From baking recipes to sports  these concepts wiggle their way into our lives on a daily basis.
Arithmetic operations,6th grade,xf5815416,https://www.khanacademy.org/math/cc-sixth-grade-math/cc-6th-arithmetic-operations,cc-6th-arithmetic-operations,The most fundamental branch of math is arithmetic operations. It consists of adding  subtracting  multiplying  and dividing numbers. We're willing to bet that doing these operations on whole numbers is a piece of cake  but now we'll mix those numbers up with decimals and fractions. We'll also introduce the idea exponents as they become much more important moving forward. So sharpen that pencil and relax in your chair  we're going for a ride!
Negative numbers,6th grade,x347111cf,https://www.khanacademy.org/math/cc-sixth-grade-math/cc-6th-negative-number-topic,cc-6th-negative-number-topic,Negative numbers are a necessary part of our understanding of mathematics and the world. The idea of anything "negative" is often seen as "bad." Negative numbers are not only good  but they're fun! Walk through this tutorial with us and we'll show you how they are defined  interpreted  and applied. Absolute value is a type of negative number that is expressed as a positive. Confused? Don't be. We got your back.
Properties of numbers,6th grade,x673b532f,https://www.khanacademy.org/math/cc-sixth-grade-math/cc-6th-factors-and-multiples,cc-6th-factors-and-multiples,Learn how to find the least common multiple (LCM) and greatest common factor (GCF).
Variables & expressions introduction,6th grade,x8ade30f9,https://www.khanacademy.org/math/cc-sixth-grade-math/cc-6th-expressions-and-variables,cc-6th-expressions-and-variables,Learn what variables are and practice using them in expressions. The major concepts covered in these tutorials are substitution  the distributive property  and combining like terms.
Equations & inequalities introduction,6th grade,x98e0520f,https://www.khanacademy.org/math/cc-sixth-grade-math/cc-6th-equations-and-inequalities,cc-6th-equations-and-inequalities,Learn about equations and inequalities that have variables in them. These tutorials focus on solving equations and understanding solutions to inequalities.
Equivalent expressions,6th grade,x77851161,https://www.khanacademy.org/math/cc-sixth-grade-math/cc-6th-equivalent-exp,cc-6th-equivalent-exp,Learn how we can combine like terms and use the distributive property to create equivalent expressions.
Geometry,6th grade,xfa626edb,https://www.khanacademy.org/math/cc-sixth-grade-math/cc-6th-geometry-topic,cc-6th-geometry-topic,Learn how to find the area  volume  and surface area of all sorts of geometric shapes. Also work with shapes on the coordinate plane.
Data and statistics,6th grade,x419abcbd,https://www.khanacademy.org/math/cc-sixth-grade-math/cc-6th-data-statistics,cc-6th-data-statistics,In statistics  we try to make sense of the world by collecting  organizing  analyzing  and presenting large amounts of data. For example  you may survey your friends about what tv show is most popular  but the small sample size will not give you an accurate idea of what ALL 6th graders like to watch. To do this you must survey a cross section of students from all around the country and all backgrounds. The data can then be statistically analyzed to give a more accurate picture of what tv show is most popular. So let's dive into a discussion of statistics  including box and whisker plots  bar charts  pictographs  line graphs  and dot plots.
Negative numbers addition and subtraction,7th grade,x7ef05b40,https://www.khanacademy.org/math/cc-seventh-grade-math/cc-7th-negative-numbers-add-and-subtract,cc-7th-negative-numbers-add-and-subtract,Add and subtract negative numbers  and see how absolute value can be used to find the distance between any two numbers on the number line.
Negative numbers multiplication and division,7th grade,x4ddd8846,https://www.khanacademy.org/math/cc-seventh-grade-math/cc-7th-negative-numbers-multiply-and-divide,cc-7th-negative-numbers-multiply-and-divide,Learn to multiply and divide negative numbers. Once you've got the basics down  we'll revisit fractions  exponents  and order of operations but this time with negatives!
Fractions decimals & percentages,7th grade,xbee72d33,https://www.khanacademy.org/math/cc-seventh-grade-math/cc-7th-fractions-decimals,cc-7th-fractions-decimals,In these tutorials  we'll explore the number system. We'll convert fractions to decimals  operate on numbers in different forms  meet complex fractions  and identify types of numbers. We'll also solve interesting word problems involving percentages (discounts  taxes  and tip calculations).
Rates & proportional relationships,7th grade,x805b3a5e,https://www.khanacademy.org/math/cc-seventh-grade-math/cc-7th-ratio-proportion,cc-7th-ratio-proportion,Learn all about proportional relationships. How are they connected to ratios and rates? What do their graphs look like? What types of word problems can we solve with proportions?
Expressions equations & inequalities,7th grade,x0a8c9f98,https://www.khanacademy.org/math/cc-seventh-grade-math/cc-7th-variables-expressions,cc-7th-variables-expressions,Bring on the algebra! Learn how to manipulate expressions and solve equations and inequalities.
Geometry,7th grade,xc1a4d524,https://www.khanacademy.org/math/cc-seventh-grade-math/cc-7th-geometry,cc-7th-geometry,Geometric shapes are all around us. The world is built with them. In this series of tutorials and exercises you'll become familiar with Euclidean geometry and terms like segments  scale drawings  parts of a circle  area  volume  angles  and geometric figures.
Statistics and probability,7th grade,x657459cb,https://www.khanacademy.org/math/cc-seventh-grade-math/cc-7th-probability-statistics,cc-7th-probability-statistics,This introduction to probability and statistics explores probability models  sample spaces  compound events  random samples  and a whole lot more.
Numbers and operations,8th grade,x1afd9461,https://api.khanacademy.org/math/cc-eighth-grade-math/cc-8th-numbers-operations,cc-8th-numbers-operations,Math is all about numbers (like 89 and 3.14) and operations (like addition and multiplication). In these tutorials  we learn about a some new types of numbers and some new types of operations.
Solving equations with one unknown,8th grade,xdffae55c,https://api.khanacademy.org/math/cc-eighth-grade-math/cc-8th-solving-equations,cc-8th-solving-equations,Learn how to solve more complicated  multi-step equations like 4x + 5 = 6x -7.
Linear equations and functions,8th grade,xc44ef069,https://api.khanacademy.org/math/cc-eighth-grade-math/cc-8th-linear-equations-functions,cc-8th-linear-equations-functions,Linear equations like y = 2x + 7 are called "linear" because they make a straight line when we graph them. These tutorials introduce you to linear relationships  their graphs  and functions.
Systems of equations,8th grade,x71149dce,https://api.khanacademy.org/math/cc-eighth-grade-math/cc-8th-systems-topic,cc-8th-systems-topic,A "system of equations" is when we're dealing with more than one equation at the same time. These tutorials show you how to set up and solve systems of equations.
Geometry,8th grade,x7306f126,https://api.khanacademy.org/math/cc-eighth-grade-math/cc-8th-geometry,cc-8th-geometry,In this topic  we will learn about special angles  such as angles between intersecting lines and triangle angles.  Next  we will learn about the Pythagorean theorem.  We will find volume of 3D shapes like spheres  cones  and cylinders.  Finally  we will learn about translations  rotations  reflections  and congruence and similarity.
Data and modeling,8th grade,xe83906b3,https://api.khanacademy.org/math/cc-eighth-grade-math/cc-8th-data,cc-8th-data,In this topic  we will learn about scatter plots  lines of best fit  and two-way tables.
Intro to biology,Biology,x3072dc12,https://www.khanacademy.org/science/biology/intro-to-biology,intro-to-biology,New to biology? You're in the right place! Start your biological journey here.
Chemistry of life,Biology,x676dc616,https://www.khanacademy.org/science/biology/chemistry--of-life,chemistry--of-life,Learn how chemistry makes life possible! From you  to your dog  to your dinner  to the global ecosystem  all living systems are made out of atoms that obey the basic rules of chemistry. Here  you can learn about the key properties of atoms  including what particles they contain  how they are organized  and how they form chemical bonds with one another.
Water acids and bases,Biology,xad41fac7,https://www.khanacademy.org/science/biology/water-acids-and-bases,water-acids-and-bases,Where would we be without water? Well  we probably wouldn't exist at all!  Learn more about this fascinating molecule: its hydrogen bonds  its properties  and why it's a key ingredient for biological systems of all sizes. Plus  brush up on the acid-base chemistry that takes place in water (and learn how it works in your own bloodstream)!
Properties of carbon,Biology,x3b0a9408,https://www.khanacademy.org/science/biology/properties-of-carbon,properties-of-carbon,Did you know that your body is approximately 18% carbon? Learn more about carbon and why it makes a great building block for biological molecules. We'll look at the bonding properties of carbon  the structures of hydrocarbons  different types of isomerism  and some functional groups important in biology.
Macromolecules,Biology,x378be429,https://www.khanacademy.org/science/biology/macromolecules,macromolecules,There's an old saying  "You are what you eat." In some senses  this is literally true! When we eat food  we take in the large biological molecules found in the food  including carbohydrates  proteins  lipids (such as fats)  and nucleic acids (such as DNA)  and use them to power our cells and build our bodies. Dive into the different types of macromolecules  what they are made up of  and how they are built up and broken down.
Energy and enzymes,Biology,x9ad19cd0,https://www.khanacademy.org/science/biology/energy-and-enzymes,energy-and-enzymes,You  like other living systems  are an amazing energy transformer. As you move your eyes to read these words  your body is busily converting chemical energy from your lunch into kinetic energy and thermal energy (heat). Learn more about how biological energy transfers work  as well as how protein machines called enzymes direct metabolic traffic through your cells.
Structure of a cell,Biology,x165544a8,https://www.khanacademy.org/science/biology/structure-of-a-cell,structure-of-a-cell,You  my friend  are made up of cells. Lots and lots of them. Some of them are eukaryotic (human)  but many more of them are prokaryotic  thanks to the friendly bacteria of your gut  skin  and other body systems. Jump in to learn more about prokaryotic and eukaryotic cells and the complex and beautiful structures inside of them.
Membranes and transport,Biology,xdffb52d5,https://www.khanacademy.org/science/biology/membranes-and-transport,membranes-and-transport,How do the cells in your body define their boundaries (and control what comes in or goes out)? As it turns out  cells have a sophisticated and flexible barrier  the plasma membrane  and a wide array of strategies for transporting molecules in and out. Learn more about what the membrane's made of and how different types of molecules move across it.
Cellular respiration,Biology,x43050e3d,https://www.khanacademy.org/science/biology/cellular-respiration-and-fermentation,cellular-respiration-and-fermentation,How do your cells extract energy from the food that you eat? As it turns out  cells have a network of elegant metabolic pathways dedicated to just this task. Learn more about cellular respiration  fermentation  and other processes that extract energy from fuel molecules like glucose.
Photosynthesis,Biology,xcb133ebd,https://www.khanacademy.org/science/biology/photosynthesis-in-plants,photosynthesis-in-plants,There's a lot of carbon in your body - in DNA  proteins  carbohydrates  fats  and other key biological molecules. How did that carbon get there? Drumroll... photosynthesis! Learn how plants and other photosynthetic organisms use light energy to make sugars from carbon dioxide and water  bringing both chemical energy and readily usable carbon into Earth’s global ecosystem.
Cell signaling,Biology,x84061818,https://www.khanacademy.org/science/biology/cell-signaling,cell-signaling,Did you know that your cells are continually "talking" to one another? Cells communicate by sending and receiving chemical signals. This molecular conversation allows the cells in your body to coordinate their activities  forming a functional  harmonious whole (a.k.a.  you!). Learn more about the remarkable process of cell signaling.
Cell division,Biology,xc30c1ada,https://www.khanacademy.org/science/biology/cellular-molecular-biology,cellular-molecular-biology,All living things  including you  are made up of cells. Find out how cells divide through mitosis and meiosis  how the cell cycle is controlled  and how problems in cell cycle control can lead to cancer.
Classical and molecular genetics,Biology,x9576dbb9,https://www.khanacademy.org/science/biology/classical-genetics,classical-genetics,Have you ever been told that you have your mother's eyes or grandfather's nose? Learn why traits run in families and how they're passed on. We'll look at Mendel's model of inheritance  see how it's been revised and extended in the past 150 years  and get a sneak preview of the modern concept of a gene.
DNA as the genetic material,Biology,x33d4a4bd,https://www.khanacademy.org/science/biology/dna-as-the-genetic-material,dna-as-the-genetic-material,What exactly is DNA? This seemingly simple polymer  made up of just four different types of monomers  serves as the genetic material for all living organisms. For example  your DNA provides instructions for building and maintaining your unique body and can be passed on if you have children. Learn more about the discovery  structure  and synthesis of this remarkable molecule.
Central dogma (DNA to RNA to protein),Biology,xf6c99121,https://www.khanacademy.org/science/biology/gene-expression-central-dogma,gene-expression-central-dogma,How does a gene in your DNA provide instructions for building a protein? In gene expression  a DNA sequence is first copied to make an RNA molecule  which is then "decoded" to build a protein. Learn more about this remarkable process  shared by all living things.
Gene regulation,Biology,xde1031b5,https://www.khanacademy.org/science/biology/gene-regulation,gene-regulation,You have tens of thousands of genes in your genome. Does that mean your cells express all of those genes  all the time? Not by a long shot! Even an organism as simple as a bacterium must carefully regulate gene expression  ensuring that the right genes are expressed at the right time. Learn more about the mechanisms cells use to turn genes "on" and "off."
Biotechnology,Biology,x1b57989c,https://www.khanacademy.org/science/biology/biotech-dna-technology,biotech-dna-technology,What is biotechnology? Well  if you've ever taken the antibiotic penicillin or eaten bread made with yeast  you've experienced it firsthand! Biotechnology is the use of a living organism  or some component of a living system  to make a useful product. Learn more about modern biotechnology and how it is used in research and biomedical applications.
Developmental biology,Biology,x92f1df45,https://www.khanacademy.org/science/biology/developmental-biology,developmental-biology,Did you know that a frog starts out as a single cell? In fact  so do dogs  elephants  and even human beings! Learn how multicellular organisms end up with many different cell types  organized into the tissues and organs of the body.
Bacteria and archaea,Biology,xeea661d7,https://www.khanacademy.org/science/biology/bacteria-archaea,bacteria-archaea,They're everywhere. They number in the millions of trillions of trillions. They live on every surface  in every environment  and even in your gut. That's right...I'm talking about prokaryotes! Learn more about bacteria and archaea.
Viruses,Biology,x41e306aa,https://www.khanacademy.org/science/biology/biology-of-viruses,biology-of-viruses,Viruses: Are they alive? Are they dead? Are they...undead? Learn more about these fascinating (and clinically important) particles that occupy a "gray area" between living and non-living things.
Evolution and the tree of life,Biology,x2239497e,https://www.khanacademy.org/science/biology/her,her,Discover the diversity of life on Earth and the forces that shape it! In this section  you can learn about evolution  natural selection  and the tree of life  as well as basic population genetics. Special bonus: take a peek into the amazing worlds of bacteria and viruses.
History of life on Earth,Biology,xda241cdb,https://www.khanacademy.org/science/biology/history-of-life-on-earth,history-of-life-on-earth,Our planet has an amazing history spanning about 4.5 billion years! Learn more about how Earth formed  the early history of life on Earth  and the origins of humans.
Ecology,Biology,xdff2fbf6,https://www.khanacademy.org/science/biology/ecology,ecology,Why are polar bears found only in the Arctic? Why does mildew grow in your shower and not (hopefully) in your sock drawer? Learn how ecologists study the interactions between organisms and their environment  and how these interactions affect where  and in what numbers  different types of organisms are found.
Biodiversity and conservation,Biology,xadaf2584,https://www.khanacademy.org/science/biology/biodiversity-and-conservation,biodiversity-and-conservation,From penguins to palm trees to bacteria  our planet is host to an awe-inspiring diversity of organisms. Dive deep into Earth's breathtaking biodiversity  learn why this biodiversity is in peril today  and discover what you can do to protect the species and ecosystems that support human life on Earth. This content is provided by the California Academy of Sciences.
Behavioral biology,Biology,x91a2727a,https://www.khanacademy.org/science/biology/behavioral-biology,behavioral-biology,What do a dog begging for food  and ant leaving a chemical trail to food  and a human baby learning language all have in common? These are all examples of behaviors. Behavior is a crucial way that animals interact with each other and with their environment. Learn more about types of animal behaviors and how behavior is shaped by genes and environment.
Principles of physiology,Biology,x5a51621b,https://www.khanacademy.org/science/biology/principles-of-physiology,principles-of-physiology,How is your body organized? How do your organ systems work together to keep you running? What keeps your blood at the right pH or your body at the right temperature? Learn more about tissues  organs  and organ systems and the control mechanisms that keep internal conditions steady in humans and other animals.
Human biology,Biology,xb67ac68d,https://www.khanacademy.org/science/biology/human-biology,human-biology,Your body is an amazing system! The human body is made up of groups of organs  called organ systems  that work together to keep the body in balance. In this section  we'll travel from the circulatory system  to the nervous system  to the immune system and beyond. Learn about the amazing biology that keeps your body ticking!
