title,subject,interal_id,url,id_number,description
Health care system,Health and medicine,x07fc128c,https://api.khanacademy.org/science/health-and-medicine/health-care-system,health-care-system,The health care system in the United States is rapidly changing. To better understand these changes  we review the health care insurance  drug pricing  physician compensation  and much more! Join us as we explore the basics about the health care system in the US  including a comparison with European healthcare.
Miscellaneous,Health and medicine,x069a1823,https://api.khanacademy.org/science/health-and-medicine/healthcare-misc,healthcare-misc,Every excellent party has a goodie bag  so why can’t we? Here we have the sundry videos that didn’t quite fit anywhere else. Dive right in and get educated on some of the many odds and ends in Health and Medicine. From puberty  to the ritual of the bedside exam  we hope you leave this section satisfied  and partied out!
Introduction to electrical engineering,Electrical engineering,x92dcf0b7,https://www.khanacademy.org/science/electrical-engineering/introduction-to-ee,introduction-to-ee,A summary of the math and science preparation that will help you have the best experience with electrical engineering taught on Khan Academy. Become familiar with engineering numbers and notation  and learn about the two most important electrical quantities: current and voltage.
Circuit analysis,Electrical engineering,x5ed2e43e,https://www.khanacademy.org/science/electrical-engineering/ee-circuit-analysis-topic,ee-circuit-analysis-topic,Circuit analysis is the process of finding all the currents and voltages in a network of connected components. We look at the basic elements used to build circuits  and find out what happens when elements are connected together into a circuit.
Amplifiers,Electrical engineering,xa23b5095,https://www.khanacademy.org/science/electrical-engineering/ee-amplifiers,ee-amplifiers,Amplifiers make signals bigger. Amplification is often the most basic operation of an electronic circuit. There are many kinds of amplifier designs. We will describe the operational amplifier  the building block of most analog electronics.
Semiconductor devices,Electrical engineering,x7520d812,https://www.khanacademy.org/science/electrical-engineering/ee-semiconductor-devices,ee-semiconductor-devices,
Electrostatics,Electrical engineering,x1ae4591a,https://www.khanacademy.org/science/electrical-engineering/ee-electrostatics,ee-electrostatics,Electrostatics is the study of forces between charges  as described by Coulomb's Law. We develop the concept of an electric field surrounding charges. We work through examples of the electric field near a line  and near a plane  and develop formal definitions of both *electric potential* and *voltage*.
Signals and systems,Electrical engineering,xa2487c41,https://www.khanacademy.org/science/electrical-engineering/ee-signals,ee-signals,Signals and Systems covers analog and digital signal processing  ideas at the heart of modern communication and measurement. We present the basic concepts for continuous-time and discrete-time signals in the time and frequency domains. Time and frequency are related by the Fourier transform.
Home-made robots,Electrical engineering,x7f8a9b2b,https://www.khanacademy.org/science/electrical-engineering/robots,robots,Start your own robotics project with Spout  Spider  and Bit-zee!
Lego robotics,Electrical engineering,x6714e769,https://www.khanacademy.org/science/electrical-engineering/lego-robotics,lego-robotics,Introduction to the Lego NXT robotics platform
Reverse engineering,Electrical engineering,xeb4f050d,https://www.khanacademy.org/science/electrical-engineering/reverse-engin,reverse-engin,Videos exploring the way things work.
Structure and bonding,Organic chemistry,x05fcddcb,https://www.khanacademy.org/science/organic-chemistry/gen-chem-review,gen-chem-review,Let's review the basics of chemical bonds including dot structures  hybridization  bond-line structures  electronegativity  and polarity. We will also discuss how bonding and intermolecular forces relate to physical properties such as boiling point.
Resonance and acid-base chemistry,Organic chemistry,xb32d9a90,https://www.khanacademy.org/science/organic-chemistry/organic-structures,organic-structures,Let's review how to keep track of electrons using formal charges  oxidation states  oxidation-reduction reactions  and resonance structures. We will also go over the principles of acid-base chemistry.
Alkanes cycloalkanes and functional groups,Organic chemistry,x84cadce3,https://www.khanacademy.org/science/organic-chemistry/bond-line-structures-alkanes-cycloalkanes,bond-line-structures-alkanes-cycloalkanes,The properties of organic molecules depend on the structure  and knowing the names of organic compounds allow us to communicate with other chemists. We'll be learning about different aspects of molecular structure  including common functional groups and conformations.
Stereochemistry,Organic chemistry,xf2909c8a,https://www.khanacademy.org/science/organic-chemistry/stereochemistry-topic,stereochemistry-topic,Just like how your left foot doesn't quite fit your right shoe  molecules also can have properties that depend on their handedness! This property is called chirality. We will go over what makes a molecule chiral  stereoisomers  assigning configurations using the R S system  optical activity and Fischer projections.
Substitution and elimination reactions,Organic chemistry,x00b805dc,https://www.khanacademy.org/science/organic-chemistry/substitution-elimination-reactions,substitution-elimination-reactions,Sn1  Sn2  E1  and E2 reactions form the basis for understanding why certain products are more likely to form than others. We will learn about the reaction mechanisms  and how nucleophilicity and electrophilicity can be used to choose between different reaction pathways.
Alkenes and alkynes,Organic chemistry,x53149848,https://www.khanacademy.org/science/organic-chemistry/alkenes-alkynes,alkenes-alkynes,Alkenes and alkynes can be transformed into almost any other functional group you can name! We will review their nomenclature  and also learn about the vast possibility of reactions using alkenes and alkynes as starting materials.
Alcohols ethers epoxides sulfides,Organic chemistry,xa3d20bbd,https://www.khanacademy.org/science/organic-chemistry/alcohols-ethers-epoxides-sulfides,alcohols-ethers-epoxides-sulfides,Alcohol and thiol groups are important functional groups for applications ranging from enzyme reactions to making flexible contact lenses. We will be reviewing naming oxygen and sulfur containing compounds. Then we will be ready to learn about some reactions that involve alcohols  ethers  epoxides  thiols  and sulfides as both reactants and products.
Conjugated systems and pericyclic reactions,Organic chemistry,x6b80168b,https://www.khanacademy.org/science/organic-chemistry/conjugation-diels-alder-mo-theory,conjugation-diels-alder-mo-theory,Molecules with conjugation can undergo some interesting and useful reactions! We will be learning about the Diels-Alder reaction  including how to predict the stereochemistry and regiochemistry of the product based on the diene and dienophile.
Aromatic compounds,Organic chemistry,xa5a6b96a,https://www.khanacademy.org/science/organic-chemistry/aromatic-compounds,aromatic-compounds,The distinctive electronic structure of aromatic leads to some distinctive reactivity! We will be covering the naming of benzene derivatives  stability of aromatic compounds  electrophilic aromatic substitution  and nucleophilic aromatic substitution.
Aldehydes and ketones,Organic chemistry,x550a9280,https://www.khanacademy.org/science/organic-chemistry/aldehydes-ketones,aldehydes-ketones,Aldehydes and ketones can be starting materials for a range of other functional groups. We will be learning about the nomenclature and reactions of aldehydes and ketones  including how to use acetals as protecting groups.
Carboxylic acids and derivatives,Organic chemistry,xc8b79fc3,https://www.khanacademy.org/science/organic-chemistry/carboxylic-acids-derivatives,carboxylic-acids-derivatives,Did you know that many fruit aromas including banana (isoamyl acetate) and pineapple (ethyl butanoate) come from molecules containing ester groups? These compounds can be synthesized from carboxylic acids using a reaction called Fischer esterification. We will be covering naming carboxylic acids  as well as the diverse chemistry of carboxylic acid derivatives such as acid chlorides  amides  esters  and anhydrides.
Alpha carbon chemistry,Organic chemistry,xc048e3d5,https://www.khanacademy.org/science/organic-chemistry/ochem-alpha-carbon-chemistry,ochem-alpha-carbon-chemistry,The carbon that is one carbon away from an aldehyde or ketone group is the alpha carbon. The deceptively innocuous hydrogens bonded to the alpha carbon can be involved in some classic organic chemistry reactions such as aldol condensations. We will be learning about the formation of enolate anions  and how they can be used in Aldol condensations to build complex organic molecules.
Amines,Organic chemistry,x56be16f4,https://www.khanacademy.org/science/organic-chemistry/amines-topic,amines-topic,Amines are found in many biologically active molecules. Two examples are the charmingly named putrescine and cadaverine  which are formed by the breakdown of amino acids. We will be discussing the IUPAC nomenclature of amines.
Spectroscopy,Organic chemistry,x8adbb6ac,https://www.khanacademy.org/science/organic-chemistry/spectroscopy-jay,spectroscopy-jay,Spectroscopy is the study of how light interacts with matter. We can use spectroscopy to determine the structure and functional groups in organic compounds. We will be learning about how to use IR  UV/Vis  and NMR spectroscopy.
Atoms compounds and ions,AP Chemistry,xd9e2efaa,https://www.khanacademy.org/science/ap-chemistry/atoms-compounds-ions-ap,atoms-compounds-ions-ap,
Stoichiometry and molecular composition,AP Chemistry,x41ac360f,https://www.khanacademy.org/science/ap-chemistry/stoichiometry-and-molecular-composition-ap,stoichiometry-and-molecular-composition-ap,Learn about how to balance chemical equations  and how to use balanced chemical equations to do stoichiometry and molecular composition calculations.
Chemical reactions,AP Chemistry,xa4c95fd8,https://www.khanacademy.org/science/ap-chemistry/chemical-reactions-ap,chemical-reactions-ap,
Electronic structure of atoms,AP Chemistry,x6bd308bb,https://www.khanacademy.org/science/ap-chemistry/electronic-structure-of-atoms-ap,electronic-structure-of-atoms-ap,
Periodic table,AP Chemistry,x0a86ef48,https://www.khanacademy.org/science/ap-chemistry/periodic-table-ap,periodic-table-ap,
Chemical bonds,AP Chemistry,xbd8786b2,https://www.khanacademy.org/science/ap-chemistry/chemical-bonds-ap,chemical-bonds-ap,
States of matter and intermolecular forces,AP Chemistry,x58782d0e,https://www.khanacademy.org/science/ap-chemistry/states-of-matter-and-intermolecular-forces-ap,states-of-matter-and-intermolecular-forces-ap,
Gases and kinetic molecular theory,AP Chemistry,xa8fd6277,https://www.khanacademy.org/science/ap-chemistry/gases-and-kinetic-molecular-theory-ap,gases-and-kinetic-molecular-theory-ap,
Kinetics,AP Chemistry,x24baa270,https://www.khanacademy.org/science/ap-chemistry/kinetics-ap,kinetics-ap,
Thermodynamics,AP Chemistry,xc39ffdd0,https://www.khanacademy.org/science/ap-chemistry/thermodynamics-ap,thermodynamics-ap,
Chemical equilibrium,AP Chemistry,xd0b43483,https://www.khanacademy.org/science/ap-chemistry/chemical-equilibrium-ap,chemical-equilibrium-ap,
Acids and bases,AP Chemistry,xbb53d8ed,https://www.khanacademy.org/science/ap-chemistry/acids-and-bases-ap,acids-and-bases-ap,
Buffers titrations and solubility equilibria,AP Chemistry,xed957505,https://www.khanacademy.org/science/ap-chemistry/buffers-titrations-solubility-equilibria-ap,buffers-titrations-solubility-equilibria-ap,
Redox reactions and electrochemistry,AP Chemistry,xe7bf4ce2,https://www.khanacademy.org/science/ap-chemistry/redox-reactions-and-electrochemistry-ap,redox-reactions-and-electrochemistry-ap,In this tutorial we will learn about oxidation-reduction (or redox) reactions and how they can be used in galvanic cells and electrolysis.
Studying for the AP Chemistry exam?,AP Chemistry,xdbe6fe4f0f6a60aa,https://www.khanacademy.org/science/ap-chemistry/studying-for-ap-chemistry-exam-class,studying-for-ap-chemistry-exam-class,Studying for the AP Chemistry exam? Watch these videos to help you prepare!
Computer programming,Computing,xffde7c31,https://www.khanacademy.org/computing/computer-programming,computer-programming,Learn how to program drawings  animations  and games using JavaScript & ProcessingJS  or learn how to create webpages with HTML & CSS. You can share whatever you create  explore what others have created and learn from each other!
Computer science,Computing,x301707a0,https://www.khanacademy.org/computing/computer-science,computer-science,Learn select topics from computer science - algorithms (how we solve common problems in computer science and measure the efficiency of our solutions)  cryptography (how we protect secret information)  and information theory (how we encode and compress information).
Hour of Code,Computing,x54f76d4b,https://www.khanacademy.org/computing/hour-of-code,hour-of-code,Only have an hour? Learn the basics of programming  making webpages  or creating databases.
Intro to JS Drawing & Animation,Computer programming,x05187c3c,https://api.khanacademy.org/computing/computer-programming/programming,programming,Learn how to use the JavaScript language and the ProcessingJS library to create fun drawings and animations.
Intro to HTML/CSS Making webpages,Computer programming,x7441c73b,https://api.khanacademy.org/computing/computer-programming/html-css,html-css,Learn how to use HTML and CSS to make webpages. HTML is the markup language that you surround content with  to tell browsers about headings  lists  tables  etc. CSS is the stylesheet language that you style the page with  to tell browsers to change the color  font  layout  and more.
Intro to SQL Querying and managing data,Computer programming,xcffdaa1f,https://api.khanacademy.org/computing/computer-programming/sql,sql,Learn how to use SQL to store  query  and manipulate data. SQL is a special-purpose programming language designed for managing data in a relational database  and is used by a huge number of apps and organizations.
Advanced JS Games & Visualizations,Computer programming,x89af0e82,https://api.khanacademy.org/computing/computer-programming/programming-games-visualizations,programming-games-visualizations,Once you've taken Intro to JS  go here to learn techniques to help you make multi-scene programs  3d graphics  button menus  and scored games.
Advanced JS Natural Simulations,Computer programming,xc9115e5d,https://api.khanacademy.org/computing/computer-programming/programming-natural-simulations,programming-natural-simulations,Once you've taken Intro to JS  you can go through this course to learn how to combine JS  ProcessingJS  and mathematical concepts to simulate nature in your programs.  This course is a derivative of "The Nature of Code" book by Daniel Shiffman (natureofcode.com)  used under CC BY-NC.
HTML/JS Making webpages interactive,Computer programming,xb254f8dc,https://api.khanacademy.org/computing/computer-programming/html-css-js,html-css-js,Once you've taken both Intro to JS and Intro to HTML/CSS  take this course to learn how use HTML/CSS with the JavaScript DOM API to make your webpages interactive.
HTML/JS Making webpages interactive with jQuery,Computer programming,x7d10e7ab,https://api.khanacademy.org/computing/computer-programming/html-js-jquery,html-js-jquery,Learn how to use jQuery  the world's most popular JS browser library  to add interactivity to your webpages.
Meet the professional,Computer programming,xc7cc38f7,https://api.khanacademy.org/computing/computer-programming/meet-the-computing-professional,meet-the-computing-professional,What can you do with computer science and programming skills once you've learned them? We've invited people from all around the world and the industry to introduce themselves to you. Find out how diverse our field can be!
Browse Projects,Computer programming,xf409033d,https://api.khanacademy.org/computing/computer-programming/browse,browse,
Project Feedback,Computer programming,x5e3717e0,https://api.khanacademy.org/computing/computer-programming/projectfeedback,projectfeedback,
Processing.js Documentation,Computer programming,xf9c6be8d,https://api.khanacademy.org/computing/computer-programming/pjs-documentation,pjs-documentation,
Webpage Documentation,Computer programming,x76ccd5a5,https://api.khanacademy.org/computing/computer-programming/webpage-documentation,webpage-documentation,
SQL Documentation,Computer programming,x3dea311d,https://api.khanacademy.org/computing/computer-programming/sql-documentation,sql-documentation,
Algorithms,Computer science,x4cd91b0c,https://api.khanacademy.org/computing/computer-science/algorithms,algorithms,We've partnered with Dartmouth college professors Tom Cormen and Devin Balkcom to teach introductory computer science algorithms  including searching  sorting  recursion  and graph theory. Learn with a combination of articles  visualizations  quizzes  and coding challenges.
Journey into cryptography,Computer science,x48c910b6,https://api.khanacademy.org/computing/computer-science/cryptography,cryptography,How have humans protected their secret messages through history? What has changed today?
Journey into information theory,Computer science,x3b93f104,https://api.khanacademy.org/computing/computer-science/informationtheory,informationtheory,We've always been communicating.... as we moved from signal fires  to alphabets & electricity the problems remained the same.
Internet 101,Computer science,x5a0b1882,https://api.khanacademy.org/computing/computer-science/internet-intro,internet-intro,Thanks to our partners at Code.org  you can learn how the internet works - everything from WiFi and IP addresses to cybersecurity and crime.
Drawing with code,Hour of Code,x04f30905,https://www.khanacademy.org/computing/hour-of-code/hour-of-code-tutorial,hour-of-code-tutorial,
Creating webpages,Hour of Code,xc8ebd74a,https://www.khanacademy.org/computing/hour-of-code/hour-of-html,hour-of-html,Learn the basics of HTML and CSS to make your first webpage.
Creating SQL databases,Hour of Code,x64be0ec6,https://www.khanacademy.org/computing/hour-of-code/hour-of-sql,hour-of-sql,
Hour of Code (for teachers and parents),Hour of Code,x92e93331,https://www.khanacademy.org/computing/hour-of-code/hour-of-code-for-teachers,hour-of-code-for-teachers,
Drawing with code,Hour of Code,x78867405,https://www.khanacademy.org/computing/hour-of-code/hour-of-drawing-code,hour-of-drawing-code,Learn how to make drawings in code  using the JavaScript language and ProcessingJS library.
Beginnings - 600 BCE,World history,xbb787b0695e7273c,https://www.khanacademy.org/humanities/world-history/history-beginnings,history-beginnings,Where did humans come from and how did those early communities function? How did the advent of agriculture change human society (neolithic revolution)?
600 BCE - 600 CE Second-Wave Civilizations,World history,x5b63dd0b,https://www.khanacademy.org/humanities/world-history/ancient-medieval,ancient-medieval,This period lays the foundation for much of civilization as we know it today. The classical Greeks lay the cultural foundation for Western civilization. The Achaemenid Persians under Cyrus unify much of the Middle East and Egypt. Alexander the Great unifies Greece with Persia. Later  the Roman Empire dominates the Mediterranean and Europe.
600 - 1450 Regional and interregional interactions,World history,xd89fe03483112b09,https://www.khanacademy.org/humanities/world-history/medieval-times,medieval-times,The development and expansion of Islam spurs greater cross-cultural interactions with Europe  Africa  and Asia. State-building in China. Migrations in Africa and the Pacific. Human movement spreads knowledge  goods  and disease.
1450 - 1750 Renaissance and Reformation,World history,xeb4863fd,https://www.khanacademy.org/humanities/world-history/renaissance-and-reformation,renaissance-and-reformation,A tutorial about the Protestant Reformation
1750 -1900 Enlightenment and Revolution,World history,xbb820063,https://www.khanacademy.org/humanities/world-history/1600s-1800s,1600s-1800s,Do we need kings?  Can people govern themselves?  What rights do we all have?  Can science and understanding uplift all of humanity?  This topic lays the foundation for our modern thinking about the world.  From democratic revolutions to the establishment of empires backed by industrial power.
The 20th century,World history,xf121c1dc,https://www.khanacademy.org/humanities/world-history/euro-hist,euro-hist,You cannot properly understand current world events without understanding the history of the 20th Century. This topic takes us on a journey from the end of Imperialism through two world wars and the Cold War and brings us to our modern world.
The historian's toolkit,US history,x89abc00d,https://www.khanacademy.org/humanities/us-history/historians-toolkit,historians-toolkit,Learning about history isn't all grabbing golden idols from caves and running away from giant boulders. In this tutorial  learn the skills that historians use to interpret primary documents  write strong arguments  and answer questions about the past.
Worlds collide (1491-1607),US history,xa1b371c7,https://www.khanacademy.org/humanities/us-history/precontact-and-early-colonial-era,precontact-and-early-colonial-era,The history of North America began long before Columbus set foot in a new world. But once he did  things would never be the same.
Colonial America (1607-1754),US history,xa3c36e8dc0a28407,https://www.khanacademy.org/humanities/us-history/colonial-america,colonial-america,From Jamestown until the early stirrings of the American Revolution  colonial America became the foundation of the United States.
The road to revolution (1754-1800),US history,x7246f60e,https://www.khanacademy.org/humanities/us-history/road-to-revolution,road-to-revolution,From colony to nation. Explore the dramatic events that separated the United States from Britain and the trials of the young republic and its citizens.
The early republic (1800-1848),US history,x02bfae41,https://www.khanacademy.org/humanities/us-history/the-early-republic,the-early-republic,In the early nineteenth century  the United States expanded rapidly  fueled by new technology  growing markets  and the extension of democracy to all white men. But this prosperity came at a cost  gobbling up the lands of Native Americans in the West and the labor of enslaved people in the South.
The Civil War era (1844-1877),US history,x0ad44dd5,https://www.khanacademy.org/humanities/us-history/civil-war-era,civil-war-era,A house divided against itself cannot stand. The United States could no longer remain half-slave and half-free  and the ensuing war over the fate of slavery ripped apart the nation.
The Gilded Age (1865-1898),US history,x895e810f,https://www.khanacademy.org/humanities/us-history/the-gilded-age,the-gilded-age,After the Civil War  the United States emerged as the world's foremost industrial power. With that came great wealth and great poverty.
Rise to world power (1890-1945),US history,x889f2245,https://www.khanacademy.org/humanities/us-history/rise-to-world-power,rise-to-world-power,At the end of the 19th century  the industrial might of the United States propelled it into great power status. In the early 20th century  the United States grappled with its new role in the world and the effects of the second Industrial Revolution at home.
The postwar era (1945-1980),US history,xe7a9ec7f,https://www.khanacademy.org/humanities/us-history/postwarera,postwarera,The United States emerged from World War II as the wealthiest and most powerful nation in the world. But staying on top isn't easy.
The modern era (1980-present),US history,x915e408e,https://www.khanacademy.org/humanities/us-history/modern-us,modern-us,Since the election of Ronald Reagan in 1980  the Cold War has ended and a new  global era has emerged. What does that mean for the United States?
American civics,US history,x7105f0f2,https://www.khanacademy.org/humanities/us-history/american-civics-parent,american-civics-parent,What is the Electoral College? How does Social Security work? Learn the answers to these questions and more in American civics.
Surveys of history,US history,x8d361957,https://www.khanacademy.org/humanities/us-history/history-survey,history-survey,The tutorials in this topic will take you on sweeping journeys through time so that you can get the really BIG picture for how things fit together.
AP US History skills and test strategies,AP US History,x10ec50f6,https://www.khanacademy.org/humanities/ap-us-history/general-ap-us-history-skills-and-test-strategies,general-ap-us-history-skills-and-test-strategies,Learning about history isn't all grabbing golden idols from caves and running away from giant boulders. In this tutorial  learn the skills that historians use to interpret primary documents  write strong arguments  and answer questions about the past.
Period 1 1491-1607,AP US History,xb98573ef,https://www.khanacademy.org/humanities/ap-us-history/period-1,period-1,The history of North America began long before Columbus set foot in a new world. But once he did  things would never be the same.
Period 2 1607-1754,AP US History,xbca6ec8170070c1f,https://www.khanacademy.org/humanities/ap-us-history/period-2,period-2,From Jamestown until the early stirrings of the American Revolution  colonial America became the foundation of the United States.
